{
  "eventId": "e-yeongjong-2025",
  "forecastId": "f-yeongjong-2025",
  "previousForecastId": null,
  "publishedAt": "2026-09-25T09:00:00+09:00",
  "level": {
    "before": null,
    "after": 4
  },
  "peakConcurrent": {
    "before": null,
    "after": {
      "p10": 15000,
      "p50": 21000,
      "p90": 30000
    },
    "unit": "명"
  },
  "dailyMean": {
    "before": null,
    "after": {
      "p10": 40000,
      "p50": 52000,
      "p90": 70000
    },
    "unit": "명/일"
  },
  "weather": {
    "applied": false,
    "evidenceIds": [],
    "note": "행사일이 기상청 예보 범위(10일) 밖"
  }
}
